{
  "$schema": "../schemas/manifest.schema.json",
  "version": 1,
  "continue_on_error": true,
  "defaults": {
    "profile": "./profile.example.json",
    "formats": ["pdf", "docx", "json", "md"],
    "on_conflict": "rename",
    "output": {
      "directory": "../output/automation"
    }
  },
  "jobs": [
    {
      "id": "acme-frontend",
      "source": "./automation-jobs/acme-frontend.json",
      "output": {
        "folder": "acme",
        "name": "candidato-acme-frontend"
      }
    },
    {
      "id": "northwind-fullstack",
      "source": "./automation-jobs/northwind-fullstack.json",
      "output": {
        "directory": "../output/automation-custom",
        "folder": "northwind",
        "name": "candidato-northwind-fullstack"
      }
    },
    {
      "id": "vaga-inline",
      "company": "Contoso",
      "job_title": "Tech Lead",
      "job_description": "Lideranca tecnica, arquitetura, observabilidade, cloud e mentoria.",
      "base_model": "fullstack",
      "template": "executive-bold",
      "formats": "pdf,json",
      "output": {
        "folder": "contoso"
      }
    }
  ]
}
